{
  "assertions": [
    {
      "epistemic_status": "EXPLICIT",
      "extraction_provenance_id": "xp-human",
      "id": "a-001",
      "polarity": "AFFIRMED",
      "proposition_id": "p-001",
      "review": {
        "state": "UNREVIEWED"
      },
      "support": {
        "derivations": [],
        "evidence_sets": [
          {
            "evidence_ref_ids": [
              "ev-8-1-depiction"
            ],
            "id": "es-001",
            "label": "SUFFICIENT"
          },
          {
            "evidence_ref_ids": [
              "ev-20-1-retrospective"
            ],
            "id": "es-002",
            "label": "SUFFICIENT"
          }
        ]
      }
    },
    {
      "epistemic_status": "EXPLICIT",
      "extraction_provenance_id": "xp-human",
      "id": "a-002",
      "polarity": "AFFIRMED",
      "proposition_id": "p-002",
      "review": {
        "state": "UNREVIEWED"
      },
      "support": {
        "derivations": [],
        "evidence_sets": [
          {
            "evidence_ref_ids": [
              "ev-8-1-depiction"
            ],
            "id": "es-003",
            "label": "SUFFICIENT"
          }
        ]
      }
    },
    {
      "epistemic_status": "EXPLICIT",
      "extraction_provenance_id": "xp-human",
      "id": "a-003",
      "polarity": "AFFIRMED",
      "proposition_id": "p-003",
      "review": {
        "state": "UNREVIEWED"
      },
      "support": {
        "derivations": [],
        "evidence_sets": [
          {
            "evidence_ref_ids": [
              "ev-8-1-depiction"
            ],
            "id": "es-004",
            "label": "SUFFICIENT"
          }
        ]
      }
    }
  ],
  "authority_policy": "DEFAULT_V0",
  "entities": [
    {
      "id": "ent-a",
      "kind": "CHARACTER"
    },
    {
      "id": "ent-b",
      "kind": "CHARACTER"
    }
  ],
  "events": [
    {
      "anchor_id": "t-evt-meet",
      "event_kind": "ENCOUNTER",
      "id": "evt-meet"
    }
  ],
  "evidence_refs": [
    {
      "id": "ev-8-1-depiction",
      "position": {
        "key": [
          8,
          1
        ],
        "stream_id": "stream-main"
      },
      "role": "DEPICTION",
      "segment_id": "seg-8-1"
    },
    {
      "id": "ev-20-1-retrospective",
      "position": {
        "key": [
          20,
          1
        ],
        "stream_id": "stream-main"
      },
      "role": "RETROSPECTIVE",
      "segment_id": "seg-20-1"
    }
  ],
  "extraction_provenance": [
    {
      "id": "xp-human",
      "method": "HUMAN_ANNOTATION",
      "process_id": "synthetic-fixture",
      "process_version": "v0"
    }
  ],
  "mentions": [],
  "propositions": [
    {
      "args": {
        "event": {
          "kind": "EVENT",
          "ref": "evt-meet"
        }
      },
      "id": "p-001",
      "predicate": "Occurred"
    },
    {
      "args": {
        "event": {
          "kind": "EVENT",
          "ref": "evt-meet"
        },
        "participant": {
          "kind": "ENTITY",
          "ref": "ent-a"
        },
        "role": {
          "kind": "TOKEN",
          "value": "AGENT",
          "vocabulary": "participant_role"
        }
      },
      "id": "p-002",
      "predicate": "Participates"
    },
    {
      "args": {
        "event": {
          "kind": "EVENT",
          "ref": "evt-meet"
        },
        "participant": {
          "kind": "ENTITY",
          "ref": "ent-b"
        },
        "role": {
          "kind": "TOKEN",
          "value": "PATIENT",
          "vocabulary": "participant_role"
        }
      },
      "id": "p-003",
      "predicate": "Participates"
    }
  ],
  "schema_version": "canonical_story/v0",
  "source_documents": [
    {
      "id": "doc-1",
      "media_kind": "synthetic_text",
      "story_id": "story-h",
      "stream_id": "stream-main",
      "version": "synthetic-1"
    }
  ],
  "source_segments": [
    {
      "document_id": "doc-1",
      "id": "seg-8-1",
      "locator": {
        "kind": "synthetic_unit",
        "part": 1,
        "unit": 8
      },
      "position": {
        "key": [
          8,
          1
        ],
        "stream_id": "stream-main"
      }
    },
    {
      "document_id": "doc-1",
      "id": "seg-20-1",
      "locator": {
        "kind": "synthetic_unit",
        "part": 1,
        "unit": 20
      },
      "position": {
        "key": [
          20,
          1
        ],
        "stream_id": "stream-main"
      }
    }
  ],
  "story": {
    "discourse_stream_id": "stream-main",
    "editorial_label": "synthetic story",
    "id": "story-h"
  },
  "temporal_anchors": [
    {
      "anchor_kind": "EVENT_TIME",
      "event_id": "evt-meet",
      "id": "t-evt-meet"
    }
  ]
}
