{
  "assertions": [
    {
      "epistemic_status": "EXPLICIT",
      "extraction_provenance_id": "xp-human",
      "id": "a-001",
      "polarity": "AFFIRMED",
      "proposition_id": "p-001",
      "review": {
        "state": "UNREVIEWED"
      },
      "support": {
        "derivations": [],
        "evidence_sets": [
          {
            "evidence_ref_ids": [
              "ev-4-1-depiction"
            ],
            "id": "es-001",
            "label": "SUFFICIENT"
          }
        ]
      }
    },
    {
      "epistemic_status": "EXPLICIT",
      "extraction_provenance_id": "xp-human",
      "id": "a-002",
      "polarity": "OPEN",
      "proposition_id": "p-002",
      "review": {
        "state": "UNREVIEWED"
      },
      "support": {
        "derivations": [],
        "evidence_sets": [
          {
            "evidence_ref_ids": [
              "ev-4-1-depiction"
            ],
            "id": "es-002",
            "label": "SUFFICIENT"
          }
        ]
      }
    },
    {
      "epistemic_status": "EXPLICIT",
      "extraction_provenance_id": "xp-human",
      "id": "a-003",
      "polarity": "AFFIRMED",
      "proposition_id": "p-003",
      "review": {
        "state": "UNREVIEWED"
      },
      "support": {
        "derivations": [],
        "evidence_sets": [
          {
            "evidence_ref_ids": [
              "ev-22-1-depiction"
            ],
            "id": "es-003",
            "label": "SUFFICIENT"
          }
        ]
      }
    }
  ],
  "authority_policy": "DEFAULT_V0",
  "entities": [
    {
      "id": "ent-a",
      "kind": "CHARACTER"
    },
    {
      "editorial_label": "the stranger",
      "id": "ent-u",
      "kind": "CHARACTER",
      "placeholder": true
    }
  ],
  "events": [],
  "evidence_refs": [
    {
      "id": "ev-4-1-depiction",
      "position": {
        "key": [
          4,
          1
        ],
        "stream_id": "stream-main"
      },
      "role": "DEPICTION",
      "segment_id": "seg-4-1"
    },
    {
      "id": "ev-22-1-depiction",
      "position": {
        "key": [
          22,
          1
        ],
        "stream_id": "stream-main"
      },
      "role": "DEPICTION",
      "segment_id": "seg-22-1"
    }
  ],
  "extraction_provenance": [
    {
      "id": "xp-human",
      "method": "HUMAN_ANNOTATION",
      "process_id": "synthetic-fixture",
      "process_version": "v0"
    }
  ],
  "mentions": [
    {
      "evidence_ref_id": "ev-4-1-depiction",
      "id": "men-u",
      "surface_form": "the stranger"
    }
  ],
  "propositions": [
    {
      "args": {
        "entity": {
          "kind": "ENTITY",
          "ref": "ent-u"
        },
        "mention": {
          "kind": "MENTION",
          "ref": "men-u"
        }
      },
      "id": "p-001",
      "predicate": "RefersTo"
    },
    {
      "args": {
        "entity": {
          "kind": "ENTITY",
          "ref": "ent-u"
        }
      },
      "id": "p-002",
      "predicate": "IdentityKnown"
    },
    {
      "args": {
        "first": {
          "kind": "ENTITY",
          "ref": "ent-u"
        },
        "second": {
          "kind": "ENTITY",
          "ref": "ent-a"
        }
      },
      "id": "p-003",
      "predicate": "SameAs"
    }
  ],
  "schema_version": "canonical_story/v0",
  "source_documents": [
    {
      "id": "doc-1",
      "media_kind": "synthetic_text",
      "story_id": "story-j",
      "stream_id": "stream-main",
      "version": "synthetic-1"
    }
  ],
  "source_segments": [
    {
      "document_id": "doc-1",
      "id": "seg-4-1",
      "locator": {
        "kind": "synthetic_unit",
        "part": 1,
        "unit": 4
      },
      "position": {
        "key": [
          4,
          1
        ],
        "stream_id": "stream-main"
      }
    },
    {
      "document_id": "doc-1",
      "id": "seg-22-1",
      "locator": {
        "kind": "synthetic_unit",
        "part": 1,
        "unit": 22
      },
      "position": {
        "key": [
          22,
          1
        ],
        "stream_id": "stream-main"
      }
    }
  ],
  "story": {
    "discourse_stream_id": "stream-main",
    "editorial_label": "synthetic story",
    "id": "story-j"
  },
  "temporal_anchors": []
}
